{
  "schema": "tradecat_auto.position_management_thesis.v1",
  "schema_version": "1.0.0",
  "ok": true,
  "mode": "paper",
  "action": "reduce",
  "symbol": "IRYSUSDT",
  "position_ref": {
    "position_id": "paper-position-001",
    "symbol": "IRYSUSDT"
  },
  "reason": "Agent explicitly reduces local paper risk after updated public context.",
  "paper_intent": {
    "reduce_fraction": 0.5,
    "agent_authorized": true,
    "real_order": false
  },
  "error_code": null,
  "provenance": {
    "source": "position_management_thesis_fixture",
    "research_cycle_run_id": "cycle-005",
    "agent": "hermes",
    "generated_at": "2026-05-18T00:20:00Z"
  },
  "safety": {
    "public_readonly_market_data": true,
    "public_readonly": true,
    "paper_or_watch_only": true,
    "real_orders": false,
    "signed_requests": false,
    "reads_api_keys": false,
    "binance_account_state": false
  },
  "hard_boundaries": {
    "real_orders": false,
    "signed_requests": false,
    "reads_api_keys": false,
    "binance_account_state": false
  },
  "limitations": [
    "paper/watch reduce intent only",
    "not a real Binance order"
  ]
}
