{
  "schema": "tradecat_auto.position_management_thesis.v1",
  "schema_version": "1.0.0",
  "ok": true,
  "mode": "paper",
  "action": "add",
  "symbol": "IRYSUSDT",
  "reason": "Agent explicitly authorizes an additional local paper position.",
  "paper_intent": {
    "side": "LONG",
    "requested_margin_usdt": 12,
    "paper_leverage": 2,
    "agent_authorized": true,
    "real_order": false
  },
  "error_code": null,
  "provenance": {
    "source": "position_management_thesis_fixture",
    "research_cycle_run_id": "cycle-004",
    "agent": "hermes",
    "generated_at": "2026-05-18T00:15:00Z"
  },
  "safety": {
    "public_readonly_market_data": true,
    "public_readonly": true,
    "paper_or_watch_only": true,
    "real_orders": false,
    "signed_requests": false,
    "reads_api_keys": false,
    "binance_account_state": false
  },
  "hard_boundaries": {
    "real_orders": false,
    "signed_requests": false,
    "reads_api_keys": false,
    "binance_account_state": false
  },
  "limitations": [
    "paper/watch add intent only",
    "no real order is authorized"
  ]
}
